{
 "archive_format_version": 1,
 "build_mode": "dev",
 "file_count": 599,
 "files": [
  {
   "layer": "plugin",
   "mode": "0644",
   "path": ".claude-plugin/README.md",
   "sha256": "1faa9a6f4ce3cdb36ba8b21f0f3d86104830f74a84d0a8659b74d9838c002282",
   "size": 7769
  },
  {
   "layer": "plugin",
   "mode": "0644",
   "path": ".claude-plugin/VSCODE_INSTALL.md",
   "sha256": "6a8b860016482626c15ebbb8f33d9f6b2dced8d07b9df3de48236b87be40c8bc",
   "size": 4021
  },
  {
   "layer": "plugin",
   "mode": "0644",
   "path": ".claude-plugin/adapter.json",
   "sha256": "f0d5b1d68fb4c4a0ab51bbe80b8dbb44e73f510b22971ca3a5727613e51ffd2a",
   "size": 2156
  },
  {
   "layer": "plugin",
   "mode": "0644",
   "path": ".claude-plugin/export.py",
   "sha256": "944de4765a585b1f2cc8a6ea1624752afdf81cf100d76e8397f5feb5b07295a2",
   "size": 4177
  },
  {
   "layer": "plugin",
   "mode": "0644",
   "path": ".claude-plugin/templates/claude-plugin.json",
   "sha256": "096504addc7ddf15662992ae4fc2a5fd0f68ef8c318e05b42f23fabea571b293",
   "size": 199
  },
  {
   "layer": "plugin",
   "mode": "0644",
   "path": ".claude-plugin/templates/mcp.json",
   "sha256": "6f680a16339abb3bfc5216e9b3a8f2dd117a657b0dba252348d5e0889b8dec95",
   "size": 116
  },
  {
   "layer": "plugin",
   "mode": "0644",
   "path": ".claude-plugin/verify.py",
   "sha256": "2eab134d5eabd0e37ba583c4c220a44cd956c9778e7231443b4ffcad611be5b0",
   "size": 11814
  },
  {
   "layer": "plugin",
   "mode": "0644",
   "path": ".codex-plugin/MARKETPLACE_INSTALL.md",
   "sha256": "8823a4a8144055953eecfc4987ee2202921511d3613e0988be9f8aca9dea2d61",
   "size": 3957
  },
  {
   "layer": "plugin",
   "mode": "0644",
   "path": ".codex-plugin/README.md",
   "sha256": "3fd63781251bc89d0ce6136af98f2f4e361a83870aef3fcc1c8d70fca1b964d7",
   "size": 2335
  },
  {
   "layer": "plugin",
   "mode": "0644",
   "path": ".codex-plugin/adapter.json",
   "sha256": "957a545e04636cecb5c1c5dc9148de672f019b1628a172337fefd6f98344d129",
   "size": 1980
  },
  {
   "layer": "plugin",
   "mode": "0644",
   "path": ".codex-plugin/export.py",
   "sha256": "72a7ea33ce0b1340f5d75866be9b30614e03d8b246ba9b142a24e457decfe8a7",
   "size": 4292
  },
  {
   "layer": "plugin",
   "mode": "0644",
   "path": ".codex-plugin/templates/config.toml",
   "sha256": "a0368ac46aaf3e3b653a52ef4f7beeb8a9bf9c79b2d65a547dec24af4747ad16",
   "size": 51
  },
  {
   "layer": "plugin",
   "mode": "0644",
   "path": ".codex-plugin/templates/mcp.json",
   "sha256": "dca02cf7653f42af9f3add753e7639fc9f9ca8501b2a22acb9f00f4d029e2185",
   "size": 277
  },
  {
   "layer": "plugin",
   "mode": "0644",
   "path": ".codex-plugin/templates/plugin.json",
   "sha256": "08312a7cf78b3595950dfe6b76157bedb788c5986a67ae341417113465078d99",
   "size": 442
  },
  {
   "layer": "plugin",
   "mode": "0644",
   "path": ".codex-plugin/verify.py",
   "sha256": "9c016a344e2d1f453f50d0638a9e744bd8dc3838fe70d791c1168f5fe0cbf1f3",
   "size": 14061
  },
  {
   "layer": "docs",
   "mode": "0644",
   "path": "CHANGELOG.md",
   "sha256": "a4e1e818280b82d4b1aa42f452a3bd259c8451ea06856ec4cbb9e38b701321a2",
   "size": 3614
  },
  {
   "layer": "core-skill",
   "mode": "0644",
   "path": "SKILL.md",
   "sha256": "98137f39039ff6ddc3e484e99a94ba4b155509491577ecac5c998b744fcfac3c",
   "size": 8000
  },
  {
   "layer": "core-foundation",
   "mode": "0644",
   "path": "VERSION",
   "sha256": "e9dd8507f4bf0c6f42458e41aea833ad0bd3f6127272335eee9bf4d58541ed67",
   "size": 6
  },
  {
   "layer": "plugin",
   "mode": "0644",
   "path": "adapters/CONTRACT.md",
   "sha256": "6e043e1bf0dbb484aa88f3bd2c5759c76782b6dfdc3996eb489bcf991033a579",
   "size": 3177
  },
  {
   "layer": "plugin",
   "mode": "0644",
   "path": "adapters/README.md",
   "sha256": "fb4345513fa27c243ab65263c5dc30f116aaeee83db1f04424083fa7ce26b70e",
   "size": 1264
  },
  {
   "layer": "plugin",
   "mode": "0644",
   "path": "adapters/common/__init__.py",
   "sha256": "cbc1c3d3a6d37415d34a5ccba2cb3a61c3e34c6dd8affb03da6884ffc17d2436",
   "size": 307
  },
  {
   "layer": "plugin",
   "mode": "0644",
   "path": "adapters/common/bundle.py",
   "sha256": "217fc1eb0d31f3e25b87f7c509d7e7c7c4b7553ca70414d1b7cde5bff0824494",
   "size": 7921
  },
  {
   "layer": "plugin",
   "mode": "0644",
   "path": "adapters/common/descriptor.py",
   "sha256": "21996ecde359a7861facf3d6df70d26cdb5abffb74816a3256e5203e6d5512e5",
   "size": 1786
  },
  {
   "layer": "plugin",
   "mode": "0644",
   "path": "adapters/common/mcp_smoke.py",
   "sha256": "622fbd5093602d71fffc422fc08cb379c2fcbc64bea1ea540c59b68f6ee36f3f",
   "size": 6908
  },
  {
   "layer": "plugin",
   "mode": "0644",
   "path": "adapters/common/verify.py",
   "sha256": "cbfe08c2bfd43da82cd3d642ff66c91fea9058c7c720e99e1dcb79f0918808d1",
   "size": 2413
  },
  {
   "layer": "plugin",
   "mode": "0644",
   "path": "adapters/generic/README.md",
   "sha256": "f67bba31971066d578d5d0bb1e54ba17801eb383bd896d75f1f66dcb28fed28e",
   "size": 1354
  },
  {
   "layer": "plugin",
   "mode": "0644",
   "path": "adapters/generic/adapter.json",
   "sha256": "b0c10b9edfa423fbf860a522d52780f0fc5115d806b0c479f6e432132daba81a",
   "size": 1401
  },
  {
   "layer": "plugin",
   "mode": "0644",
   "path": "adapters/generic/adapter.py",
   "sha256": "4f6720cf358205642c5d426d6435f0dc7e42143bac772dfd51f3711d919b0ab0",
   "size": 9110
  },
  {
   "layer": "plugin",
   "mode": "0644",
   "path": "adapters/mcp/README.md",
   "sha256": "68a4c1818aeab1c5cb321336cafdb53ecd33ae1044b886780b5a4ebcd2882fdb",
   "size": 2835
  },
  {
   "layer": "plugin",
   "mode": "0644",
   "path": "adapters/mcp/__init__.py",
   "sha256": "efe98288d500b3a20d2b6fc88f4ebc38cdca0b25498893b6275864a59ba9cf7a",
   "size": 238
  },
  {
   "layer": "plugin",
   "mode": "0644",
   "path": "adapters/mcp/adapter.json",
   "sha256": "ac191c34a24feeb8f3bb6387b52de681d0fc55cc559cd238e3c87279a96b56e3",
   "size": 1449
  },
  {
   "layer": "plugin",
   "mode": "0644",
   "path": "adapters/mcp/protocol.py",
   "sha256": "b2585daee2f1de9fb9c95c01d41dd8758e5b470ef88d9d360deeeaf3d798b0be",
   "size": 2546
  },
  {
   "layer": "plugin",
   "mode": "0644",
   "path": "adapters/mcp/server.py",
   "sha256": "8805333f88e3a8ad81e951a3d95d77a58f330d67c43c887cf355cfe12ff8381e",
   "size": 9356
  },
  {
   "layer": "evals",
   "mode": "0644",
   "path": "evals/README.md",
   "sha256": "91ec7b357442e785625135c92d7ce62aad21f939c709508d1375da7fcb07a729",
   "size": 1444
  },
  {
   "layer": "evals",
   "mode": "0644",
   "path": "evals/failure-taxonomy.md",
   "sha256": "7647014c43eb3eb25d8a5c6ba83522d68ed36699e273623f8cd6b4d1e905f2d3",
   "size": 6815
  },
  {
   "layer": "evals",
   "mode": "0644",
   "path": "evals/fixtures/empty-project/README.md",
   "sha256": "6c0804275081c37e280f0e83d4f7f97ce564be86aad544b8b2c437ac63b54680",
   "size": 145
  },
  {
   "layer": "evals",
   "mode": "0644",
   "path": "evals/fixtures/execution-no-browser/README.md",
   "sha256": "10d078c90db1b9a8d002bc025e75ee8ca60c1b23bccf8d66318fa7aeadffadbd",
   "size": 228
  },
  {
   "layer": "evals",
   "mode": "0644",
   "path": "evals/fixtures/execution-playwright-project/README.md",
   "sha256": "6676b10528a4386a065d3923709d2970f572ce5f4966966c6ae9c5623562b167",
   "size": 260
  },
  {
   "layer": "evals",
   "mode": "0644",
   "path": "evals/fixtures/execution-running-server/README.md",
   "sha256": "7494272db5c25b952d8b1d2a1b594f109f02fabf45c9ec11f4bcb3468f5ab5ed",
   "size": 178
  },
  {
   "layer": "evals",
   "mode": "0644",
   "path": "evals/fixtures/inconsistent-project/README.md",
   "sha256": "079a6eea47fe8eaa183739fd8b6bd9463f3119396f9f4b6f4afae20ed8a47a3a",
   "size": 243
  },
  {
   "layer": "evals",
   "mode": "0644",
   "path": "evals/fixtures/inspiration/bad-font-pairing/README.md",
   "sha256": "3dd2fc88f62d67073ac6b1ab8cd1d13b50cbef4c44f53cf1c401442d102cd3bb",
   "size": 586
  },
  {
   "layer": "evals",
   "mode": "0644",
   "path": "evals/fixtures/inspiration/developer-product/README.md",
   "sha256": "e1eb616bbb7c953f18611a3b60abce557575ebbbdbacf1293c0141c7ef0911f4",
   "size": 598
  },
  {
   "layer": "evals",
   "mode": "0644",
   "path": "evals/fixtures/inspiration/editorial-product/README.md",
   "sha256": "762e3fe3db44186e737068b2e9eda75428b2d9c5374c4bb783101e361475075f",
   "size": 486
  },
  {
   "layer": "evals",
   "mode": "0644",
   "path": "evals/fixtures/inspiration/existing-motion-framework/README.md",
   "sha256": "6112f6190f597cb602e0f7f9659330c3be3e7d14e787151b512f1a5eb5238468",
   "size": 393
  },
  {
   "layer": "evals",
   "mode": "0644",
   "path": "evals/fixtures/inspiration/generic-landing/README.md",
   "sha256": "9ecbf494778ced0c6ebad26bb6077e1fa657e5e64212130bb2a2bdc308ef9840",
   "size": 700
  },
  {
   "layer": "evals",
   "mode": "0644",
   "path": "evals/fixtures/inspiration/good-typography-motion/README.md",
   "sha256": "a9ad269828db04f14b8eaa9fe051b2dd36d6e0a37ebaa59ccdf2d922ec8cffc1",
   "size": 525
  },
  {
   "layer": "evals",
   "mode": "0644",
   "path": "evals/fixtures/inspiration/missing-reduced-motion/README.md",
   "sha256": "5aa8271e910a932e5029b2dfb49ee764ea6489bd7e7b8d13d3a7bb2ce84dc4d9",
   "size": 458
  },
  {
   "layer": "evals",
   "mode": "0644",
   "path": "evals/fixtures/inspiration/motion-overuse/README.md",
   "sha256": "080cd1219f362130db374309d15115d58a649627d4cefb7c52637cbff82d1ab9",
   "size": 883
  },
  {
   "layer": "evals",
   "mode": "0644",
   "path": "evals/fixtures/inspiration/premium-landing/README.md",
   "sha256": "5e622c0658771caaaebe1867d38574f5a44593579e52ea9a50157835bda1ff5f",
   "size": 812
  },
  {
   "layer": "evals",
   "mode": "0644",
   "path": "evals/fixtures/inspiration/vietnamese-typography/README.md",
   "sha256": "63b324ff3002297feec70f49ac09d12a98d78daa063d6ce416d998b3ec144196",
   "size": 542
  },
  {
   "layer": "evals",
   "mode": "0644",
   "path": "evals/fixtures/large-existing-project/README.md",